<!ELEMENT ExMitarbeiterTbl (ExMitarbeiter+)>
<!ELEMENT ExMitarbeiter (ID, Vorname, Nachname, Strasse, HausNr, PLZ, Ort, Telefon?, eMail?, Firma)>

<!ELEMENT ID (#PCDATA)>
<!ELEMENT Vorname (#PCDATA)>
<!ELEMENT Nachname (#PCDATA)>
<!ELEMENT Strasse (#PCDATA)>
<!ELEMENT HausNr (#PCDATA)>
<!ELEMENT PLZ (#PCDATA)>
<!ELEMENT Ort (#PCDATA)>
<!ELEMENT Telefon (#PCDATA)>
<!ELEMENT eMail (#PCDATA)>
<!ELEMENT Firma (#PCDATA)>
